{
  "components": [
    {
      "id": "cmp_fbbec2ff-ad45-57f2-a51b-febb3a99df39",
      "ref": "D1",
      "value": "LED",
      "lib_symbol_ref": "Mini:Mini_LED",
      "lib_footprint_ref": "Mini:Mini_LED_THT_3mm",
      "properties": {
        "fenolite.path": "D1"
      },
      "pins": [
        {
          "id": "pin_0e872b04-d17b-5520-821e-6ba36d491211",
          "number": "2",
          "name": "A"
        },
        {
          "id": "pin_c27a6659-7c47-5224-a809-4940493e3354",
          "number": "1",
          "name": "K"
        }
      ]
    },
    {
      "id": "cmp_441d84bd-48ed-583c-88bf-70a3396f47ed",
      "ref": "R1",
      "value": "330",
      "lib_symbol_ref": "Mini:Mini_R",
      "lib_footprint_ref": "Mini:Mini_R_0603",
      "properties": {
        "fenolite.path": "R1"
      },
      "pins": [
        {
          "id": "pin_32a8a86c-7190-5f2f-ba46-fa755d7d620d",
          "number": "1"
        },
        {
          "id": "pin_8003e959-ea9b-5eaf-a7dc-b60e07cc9255",
          "number": "2"
        }
      ]
    },
    {
      "id": "cmp_a52d7a61-7049-5450-a2cd-5d47241f03fa",
      "ref": "U1",
      "value": "MCU",
      "lib_symbol_ref": "Mini:Mini_QFP32_IC",
      "lib_footprint_ref": "Mini:Mini_QFP-32_7x7mm_P0.8mm",
      "properties": {
        "fenolite.path": "U1"
      },
      "pins": [
        {
          "id": "pin_a5426a72-b891-52b5-a6cc-8bc118f091ff",
          "number": "16"
        },
        {
          "id": "pin_d9fa9158-059c-5f71-ace0-4df4b520659d",
          "number": "32",
          "name": "EP"
        },
        {
          "id": "pin_5a10d344-d564-53c4-9bb6-6fee823edc65",
          "number": "10",
          "name": "GND",
          "etype": "power_in"
        },
        {
          "id": "pin_d0acee89-4df7-5f1a-8f52-52ee84d057ad",
          "number": "11",
          "name": "NRST",
          "etype": "input"
        },
        {
          "id": "pin_da198ad7-e211-5153-a841-236b38200347",
          "number": "12",
          "name": "OSC_IN",
          "etype": "input"
        },
        {
          "id": "pin_cb91eec4-b922-54a5-8601-dc795b179216",
          "number": "13",
          "name": "OSC_OUT",
          "etype": "output"
        },
        {
          "id": "pin_4f181cc6-402a-5e4d-9d2c-0aa19009eff6",
          "number": "1",
          "name": "PA0",
          "etype": "bidirectional"
        },
        {
          "id": "pin_2956f0e1-c50b-5a2c-bc38-46f0d38027dc",
          "number": "2",
          "name": "PA1",
          "etype": "bidirectional"
        },
        {
          "id": "pin_1636acd9-1646-55aa-87b0-df8b6dda4154",
          "number": "3",
          "name": "PA2",
          "etype": "bidirectional"
        },
        {
          "id": "pin_2b187cda-2be3-562f-b45e-a54ba69ce9f0",
          "number": "4",
          "name": "PA3",
          "etype": "bidirectional"
        },
        {
          "id": "pin_e3862078-c293-5bdb-ba5f-62c0161c484c",
          "number": "5",
          "name": "PA4",
          "etype": "bidirectional"
        },
        {
          "id": "pin_e4dbc905-0bc3-56b5-a453-67a2d53c958e",
          "number": "6",
          "name": "PA5",
          "etype": "bidirectional"
        },
        {
          "id": "pin_b562b317-77b2-5bf2-b056-335801023b75",
          "number": "7",
          "name": "PA6",
          "etype": "bidirectional"
        },
        {
          "id": "pin_27aa252f-f381-58d0-aace-9c3b9eeed6d1",
          "number": "8",
          "name": "PA7",
          "etype": "bidirectional"
        },
        {
          "id": "pin_a7d8dc01-de52-51a2-a269-4b2ac93cb3fe",
          "number": "14",
          "name": "PB0",
          "etype": "bidirectional"
        },
        {
          "id": "pin_8107fbe6-fe94-5d2f-a566-f46558bc0b02",
          "number": "15",
          "name": "PB1",
          "etype": "tri_state"
        },
        {
          "id": "pin_846acdd1-ff78-5e23-9320-5413f3ec5b22",
          "number": "25",
          "name": "PB10",
          "etype": "bidirectional"
        },
        {
          "id": "pin_e727b239-bf95-5144-90b8-5b039f9c9ded",
          "number": "26",
          "name": "PB11",
          "etype": "bidirectional"
        },
        {
          "id": "pin_0facda70-902a-5b7f-acee-609a0efb7af9",
          "number": "27",
          "name": "PB12",
          "etype": "bidirectional"
        },
        {
          "id": "pin_efef10f3-bc8a-5aa9-a81f-da9bbe982bef",
          "number": "28",
          "name": "PB13",
          "etype": "bidirectional"
        },
        {
          "id": "pin_4f9728cb-627b-56d2-b7c4-35aff5e61aa5",
          "number": "29",
          "name": "PB14",
          "etype": "bidirectional"
        },
        {
          "id": "pin_512c8e25-8a6a-5330-9a40-080066e30608",
          "number": "30",
          "name": "PB15",
          "etype": "bidirectional"
        },
        {
          "id": "pin_acc75d8a-c170-559d-8b82-4d383b5a64d8",
          "number": "31",
          "name": "PB16",
          "etype": "bidirectional"
        },
        {
          "id": "pin_74a342b3-01dc-5720-80ed-cd09876a2b84",
          "number": "17",
          "name": "PB2",
          "etype": "bidirectional"
        },
        {
          "id": "pin_04b3a07b-3188-5eac-83bd-54d5399ea8b0",
          "number": "18",
          "name": "PB3",
          "etype": "bidirectional"
        },
        {
          "id": "pin_3cd0c668-1347-5f7b-8dbd-a8f6711e67f6",
          "number": "19",
          "name": "PB4",
          "etype": "bidirectional"
        },
        {
          "id": "pin_7a365059-f74a-5bb6-b461-4b59472c2e57",
          "number": "20",
          "name": "PB5",
          "etype": "bidirectional"
        },
        {
          "id": "pin_f730c037-e821-55ed-82f4-1cff249b727e",
          "number": "21",
          "name": "PB6",
          "etype": "bidirectional"
        },
        {
          "id": "pin_6c570dc4-5ed8-5c8a-b589-cd7d20958cab",
          "number": "22",
          "name": "PB7",
          "etype": "bidirectional"
        },
        {
          "id": "pin_717e6010-b5fe-5465-a37a-ab4d7c37871d",
          "number": "23",
          "name": "PB8",
          "etype": "bidirectional"
        },
        {
          "id": "pin_d7fafe26-6ab8-59ef-b133-418fc78ec668",
          "number": "24",
          "name": "PB9",
          "etype": "bidirectional"
        },
        {
          "id": "pin_93fc0205-9549-5655-80dd-d9a344ecf64d",
          "number": "9",
          "name": "VDD",
          "etype": "power_in"
        }
      ]
    }
  ],
  "nets": [
    {
      "id": "net_bb8206a2-c41f-5230-98a5-c5a81db5be8d",
      "name": "GND",
      "netclass_id": "cls_710c21e9-ef47-5ce1-ab78-291a6ed46834",
      "members": [
        {
          "component_id": "cmp_a52d7a61-7049-5450-a2cd-5d47241f03fa",
          "pin": "10"
        },
        {
          "component_id": "cmp_fbbec2ff-ad45-57f2-a51b-febb3a99df39",
          "pin": "1"
        }
      ]
    },
    {
      "id": "net_2eadbf81-833a-591e-adfc-0b23f78a5300",
      "name": "LED_A",
      "members": [
        {
          "component_id": "cmp_441d84bd-48ed-583c-88bf-70a3396f47ed",
          "pin": "2"
        },
        {
          "component_id": "cmp_fbbec2ff-ad45-57f2-a51b-febb3a99df39",
          "pin": "2"
        }
      ]
    },
    {
      "id": "net_dae0ce4a-e0ac-5235-b527-0ef94416b78c",
      "name": "LED_DRV",
      "members": [
        {
          "component_id": "cmp_441d84bd-48ed-583c-88bf-70a3396f47ed",
          "pin": "1"
        },
        {
          "component_id": "cmp_a52d7a61-7049-5450-a2cd-5d47241f03fa",
          "pin": "1"
        }
      ]
    },
    {
      "id": "net_c2a60b21-fa5a-514f-9789-d699c7169bb6",
      "name": "VIN",
      "netclass_id": "cls_710c21e9-ef47-5ce1-ab78-291a6ed46834",
      "members": [
        {
          "component_id": "cmp_a52d7a61-7049-5450-a2cd-5d47241f03fa",
          "pin": "9"
        }
      ]
    }
  ],
  "netclasses": [
    {
      "id": "cls_710c21e9-ef47-5ce1-ab78-291a6ed46834",
      "name": "PWR",
      "clearance": 200000,
      "track_width": 500000
    }
  ],
  "interfaces": [
    {
      "id": "itf_1280140e-1f55-5329-a16f-9390fbd961e9",
      "name": "VIN/GND",
      "kind": "power",
      "members": {
        "hv": "net_c2a60b21-fa5a-514f-9789-d699c7169bb6",
        "lv": "net_bb8206a2-c41f-5230-98a5-c5a81db5be8d"
      }
    }
  ],
  "no_connects": [
    {
      "component_id": "cmp_a52d7a61-7049-5450-a2cd-5d47241f03fa",
      "pin": "11"
    },
    {
      "component_id": "cmp_a52d7a61-7049-5450-a2cd-5d47241f03fa",
      "pin": "12"
    },
    {
      "component_id": "cmp_a52d7a61-7049-5450-a2cd-5d47241f03fa",
      "pin": "13"
    },
    {
      "component_id": "cmp_a52d7a61-7049-5450-a2cd-5d47241f03fa",
      "pin": "14"
    },
    {
      "component_id": "cmp_a52d7a61-7049-5450-a2cd-5d47241f03fa",
      "pin": "15"
    },
    {
      "component_id": "cmp_a52d7a61-7049-5450-a2cd-5d47241f03fa",
      "pin": "16"
    },
    {
      "component_id": "cmp_a52d7a61-7049-5450-a2cd-5d47241f03fa",
      "pin": "17"
    },
    {
      "component_id": "cmp_a52d7a61-7049-5450-a2cd-5d47241f03fa",
      "pin": "18"
    },
    {
      "component_id": "cmp_a52d7a61-7049-5450-a2cd-5d47241f03fa",
      "pin": "19"
    },
    {
      "component_id": "cmp_a52d7a61-7049-5450-a2cd-5d47241f03fa",
      "pin": "2"
    },
    {
      "component_id": "cmp_a52d7a61-7049-5450-a2cd-5d47241f03fa",
      "pin": "20"
    },
    {
      "component_id": "cmp_a52d7a61-7049-5450-a2cd-5d47241f03fa",
      "pin": "21"
    },
    {
      "component_id": "cmp_a52d7a61-7049-5450-a2cd-5d47241f03fa",
      "pin": "22"
    },
    {
      "component_id": "cmp_a52d7a61-7049-5450-a2cd-5d47241f03fa",
      "pin": "23"
    },
    {
      "component_id": "cmp_a52d7a61-7049-5450-a2cd-5d47241f03fa",
      "pin": "24"
    },
    {
      "component_id": "cmp_a52d7a61-7049-5450-a2cd-5d47241f03fa",
      "pin": "25"
    },
    {